{"schema_version":"voice_pack.v2","voice_pack_version":"vp_4a91cc02","contact_id":"h_8f21a4c0","scope":"contact","n_exemplars":1,"register":{"median_len_chars":34,"emoji_rate":0.11,"punctuation":"lowercase_no_period","avg_msgs_per_burst":2.3},"exemplars":[{"text":"yes im down what time were u thinking","answered":"question_from_them","register":"warm"}],"as_of":"2026-08-01T09:14:00Z"}
